title,story_line,you_tube_trailer_url,poster_image_url,release_date,season
Westworld: S1,"Set at the intersection of the near future and the reimagined past, explore a world in which every human appetite can be indulged without consequence.",https://youtu.be/0zZcBv0gPK0,https://upload.wikimedia.org/wikipedia/en/2/28/Westworld_season_1.png,10/02/16,1
Westworld: S2,"Set at the intersection of the near future and the reimagined past, explore a world in which every human appetite can be indulged without consequence.",https://youtu.be/jukeU2FBssk,https://upload.wikimedia.org/wikipedia/en/5/50/Westworld_season_2.png,"April 22, 2018",2
Intelligence: S1,"A high-tech intelligence operative, enhanced with a super-computer microchip in his brain, aids an elite government cyber-security agency in special missions.",https://youtu.be/hizUznsCRbE,https://upload.wikimedia.org/wikipedia/en/3/32/Intelligence_Title.jpg,2005,1
Intelligence: S2,"A high-tech intelligence operative, enhanced with a super-computer microchip in his brain, aids an elite government cyber-security agency in special missions.",https://youtu.be/FYtJnnSwJKE,https://upload.wikimedia.org/wikipedia/en/4/45/Intelligence_%28TV%29_Promo_3.jpg,2007,2
Minority Report,10 years after the end of Precrime in Washington DC one of the three PreCogs attempts to lead on a normal life while still suffering from visions of the future. Will they be able to hold it together or mentally breakdown and give up? ,https://youtu.be/X2yG2rIdkbQ,https://upload.wikimedia.org/wikipedia/en/6/62/Minority_report_Intertitle.jpg,2015,1
Almost Human,"In a not-so-distant future, a human cop and an android partner up to protect and serve. ",https://youtu.be/FV2ojHR40TQ,https://upload.wikimedia.org/wikipedia/en/c/cb/Almost_Human_Main_Cast.jpg,2013,1
